{
  "schemaVersion": "lingual.curriculum_package.v1",
  "curriculum": {
    "id": "cur.fr.ap_french.fall2024.v1",
    "title": {
      "en": "AP French (Fall 2024) Units 1-3 - Speaking/Listening (B1-B2)",
      "ko": "AP 프랑스어(Fall 2024) Unit 1-3 - 말하기/듣기 (B1-B2)"
    },
    "learningLocale": "fr-FR",
    "levelBand": "B1-B2",
    "version": "1.0.0",
    "createdAt": "2026-02-18T00:00:00Z",
    "source": {
      "type": "import",
      "name": "AP French Language and Culture Course and Exam Description (CED)",
      "effective": "Fall 2024",
      "docIds": [
        "doc.ap_french.ced.fall2024"
      ]
    },
    "license": {
      "owner": "College Board",
      "notes": "No verbatim copying; objectives and descriptions are paraphrased for spoken practice."
    },
    "sortOrder": 10
  },
  "taxonomies": {
    "contextTags": [
      "alienation_assimilation",
      "architecture",
      "art_and_identity",
      "artistic_heritage",
      "advertising_marketing",
      "beliefs_values",
      "citizenship",
      "customs_ceremonies",
      "diversity_issues",
      "economic_issues",
      "education",
      "family_structures",
      "friendship_love",
      "gender_sexuality",
      "holidays_celebrations",
      "housing_shelter",
      "human_rights",
      "ideals_of_beauty",
      "intellectual_property",
      "language_identity",
      "leisure_sports",
      "literature",
      "multiculturalism",
      "music",
      "nationalism_patriotism",
      "new_media",
      "performing_arts",
      "rites_of_passage",
      "social_impacts_of_technology",
      "travel",
      "visual_arts"
    ],
    "communicativeFunctions": [
      "agree_disagree",
      "ask_follow_up",
      "ask_for_clarification",
      "compare",
      "describe_people_things",
      "express_opinion",
      "explain_cause_effect",
      "give_examples",
      "invite",
      "negotiate_plans",
      "repair_misunderstanding",
      "summarize",
      "support_with_evidence"
    ],
    "discourseMoves": [
      "compare_contrast",
      "define_terms",
      "gist_then_details",
      "hedging",
      "introduction_body_conclusion",
      "reason_then_result",
      "signposting",
      "turn_taking",
      "self_correction"
    ],
    "taskModels": [
      "ap.interview",
      "ap.instructions",
      "ap.presentation",
      "ap.audio_report_and_article",
      "ap.conversation_and_chart",
      "ap.conversation",
      "ap.cultural_presentation",
      "ap.cultural_comparison",
      "lingual.roleplay",
      "lingual.free_conversation"
    ],
    "foundationDomains": [
      "comprehension",
      "comprehensibility",
      "vocabulary_usage",
      "language_control",
      "communication_strategies",
      "cultural_awareness"
    ]
  },
  "rubrics": [
    {
      "id": "rub.listening.v1",
      "title": {
        "en": "Interpretive Listening Rubric v1",
        "ko": "해석(리스닝) 루브릭 v1"
      },
      "scale": {
        "min": 0,
        "max": 4,
        "step": 1
      },
      "dimensions": [
        {
          "id": "gist",
          "title": {
            "en": "Gist",
            "ko": "요지"
          },
          "description": {
            "en": "Understands the main point and overall meaning.",
            "ko": "핵심 요지와 전체 의미를 이해한다."
          }
        },
        {
          "id": "detail",
          "title": {
            "en": "Detail",
            "ko": "세부"
          },
          "description": {
            "en": "Identifies key supporting details (who/what/when/where).",
            "ko": "핵심 세부 정보(누가/무엇/언제/어디)를 파악한다."
          }
        },
        {
          "id": "inference",
          "title": {
            "en": "Inference",
            "ko": "추론"
          },
          "description": {
            "en": "Infers implied meaning, intent, or relationship from context.",
            "ko": "맥락을 바탕으로 암시 의미/의도/관계를 추론한다."
          }
        },
        {
          "id": "perspective",
          "title": {
            "en": "Perspective/Tone",
            "ko": "관점/태도"
          },
          "description": {
            "en": "Recognizes attitude, perspective, and culturally specific cues.",
            "ko": "태도/관점 및 문화적 단서를 파악한다."
          }
        }
      ],
      "notes": "Designed for B1-B2 audio-first practice aligned to AP interpretive expectations without copying AP items."
    },
    {
      "id": "rub.interpersonal_speaking.v1",
      "title": {
        "en": "Interpersonal Speaking Rubric v1",
        "ko": "상호작용 말하기 루브릭 v1"
      },
      "scale": {
        "min": 0,
        "max": 4,
        "step": 1
      },
      "dimensions": [
        {
          "id": "interaction_management",
          "title": {
            "en": "Interaction Management",
            "ko": "상호작용 관리"
          },
          "description": {
            "en": "Initiates, maintains, and closes the exchange; uses repair strategies.",
            "ko": "대화를 시작/유지/마무리하고 수습 전략을 사용한다."
          }
        },
        {
          "id": "comprehensibility",
          "title": {
            "en": "Comprehensibility",
            "ko": "명료성"
          },
          "description": {
            "en": "Speech is generally understandable (pronunciation, rhythm, pacing).",
            "ko": "발음/리듬/속도 측면에서 전반적으로 이해 가능하다."
          }
        },
        {
          "id": "lexical_grammatical_control",
          "title": {
            "en": "Lexical/Grammatical Control",
            "ko": "어휘/문법 통제"
          },
          "description": {
            "en": "Uses vocabulary and grammar with sufficient control for the task.",
            "ko": "과제 수행에 충분한 수준의 어휘/문법 통제를 보인다."
          }
        },
        {
          "id": "sociopragmatics",
          "title": {
            "en": "Sociopragmatics",
            "ko": "화용/레지스터"
          },
          "description": {
            "en": "Chooses register and politeness strategies appropriate to roles and context.",
            "ko": "역할/상황에 맞는 레지스터와 공손 전략을 선택한다."
          }
        }
      ],
      "notes": "Focuses on spoken interpersonal communication (AP-style conversation) for Lingual practice."
    },
    {
      "id": "rub.presentational_speaking.v1",
      "title": {
        "en": "Presentational Speaking Rubric v1",
        "ko": "발표 말하기 루브릭 v1"
      },
      "scale": {
        "min": 0,
        "max": 4,
        "step": 1
      },
      "dimensions": [
        {
          "id": "organization",
          "title": {
            "en": "Organization",
            "ko": "구성"
          },
          "description": {
            "en": "Has a clear structure with transitions.",
            "ko": "전환 표현을 포함해 구조가 명확하다."
          }
        },
        {
          "id": "argument_or_comparison",
          "title": {
            "en": "Argument/Comparison",
            "ko": "논지/비교"
          },
          "description": {
            "en": "Develops a claim or comparison with relevant support.",
            "ko": "관련 근거로 주장 또는 비교를 전개한다."
          }
        },
        {
          "id": "language_control",
          "title": {
            "en": "Language Control",
            "ko": "언어 통제"
          },
          "description": {
            "en": "Uses vocabulary/grammar accurately enough to sustain meaning.",
            "ko": "의미 전달이 유지될 만큼 어휘/문법을 정확히 사용한다."
          }
        },
        {
          "id": "delivery",
          "title": {
            "en": "Delivery",
            "ko": "전달"
          },
          "description": {
            "en": "Pronunciation, pacing, and intonation support comprehension.",
            "ko": "발음/속도/억양이 이해에 도움이 된다."
          }
        },
        {
          "id": "cultural_specificity",
          "title": {
            "en": "Cultural Specificity",
            "ko": "문화적 구체성"
          },
          "description": {
            "en": "Uses specific, non-stereotyped cultural examples and comparisons.",
            "ko": "고정관념을 피하고 구체적 문화 예시/비교를 사용한다."
          }
        }
      ],
      "notes": "Supports cultural presentation (Unit 1) and cultural comparison (Units 2-3)."
    }
  ],
  "units": [
    {
      "id": "unit.1",
      "title": {
        "en": "Families in Different Societies",
        "ko": "서로 다른 사회의 가족"
      },
      "ap": {
        "unitNumber": 1,
        "title": "Families in Different Societies",
        "primaryTheme": "Families and Communities"
      },
      "essentialQuestions": [
        {
          "en": "In Francophone contexts, what counts as family and how are family roles understood?",
          "ko": "프랑스어권 맥락에서 '가족'은 어떻게 정의되고 역할은 어떻게 이해되는가?"
        },
        {
          "en": "What values and everyday practices shape family life across Francophone communities?",
          "ko": "프랑스어권 공동체에서 가족 생활을 형성하는 가치/일상 관행은 무엇인가?"
        },
        {
          "en": "What pressures and changes do modern families experience, and how do people respond?",
          "ko": "현대 사회에서 가족이 겪는 변화/압력은 무엇이며 사람들은 어떻게 대응하는가?"
        }
      ],
      "contextTags": [
        "family_structures",
        "beliefs_values",
        "rites_of_passage",
        "holidays_celebrations",
        "education",
        "housing_shelter",
        "diversity_issues",
        "economic_issues",
        "human_rights",
        "multiculturalism"
      ],
      "moduleIds": [
        "mod.1.1",
        "mod.1.2",
        "mod.1.3"
      ],
      "sourceRefs": [
        {
          "docId": "doc.ap_french.ced.fall2024",
          "locator": "Course Framework V.1 - Unit 1 guide (themes/contexts, skill-building notes, Progress Check 1)",
          "unitNumber": 1,
          "section": "Unit Guide",
          "notes": "Used as non-verbatim alignment reference; Lingual focuses on spoken practice."
        },
        {
          "docId": "doc.ap_french.ced.fall2024",
          "locator": "Progress Check 1 task models include: Email Reply (writing), Conversation (spoken interpersonal), Cultural Presentation (spoken presentational)",
          "unitNumber": 1,